,fname,text
0,dequeuniversity.comvideo caption.txt,"dequeuniversity.comvideo caption.txt.    Axe Rules | Deque University | Deque Systems    Skip to content  Deque University  English日本語  Set Language    <video> elements must have captions Rule ID: video-caption Ruleset: axe-core 4.7 User Impact: Critical Guidelines: WCAG 2.1 (A), WCAG 2.0 (A), Section 508     Accessibility testing for dev teams - No experience required  Find and fix up to 80% of accessibility issues with axe DevTools Pro. Get started with your free trial today. No credit card needed.   Start for free   Sign up for the axe newsletter Stay up to date on axe features, updates, and events. Newsletter Sign-up   Compliance Data & Impact User Impact Critical▼  Minor Critical  Disabilities Affected Deaf  Standard(s) WCAG 2.1 (A)WCAG 2.0 (A)Section 508 WCAG Success Criteria [WCAG 2.1 (A)]1.2.2: MUST: Captions (Prerecorded)WCAG Success Criteria [WCAG 2.0 (A)]1.2.2: MUST: Captions (Prerecorded)Section 508 Guidelines1194.22: MUST: Web based intranet and Internet Information & Applications1194.22 (a): MUST: A text equivalent for every non-text element shall be provided (e.g., via ""alt"", ""longdesc"", or in element content)  How to Fix the Problem  Ensure all video elements have a caption using the track element with caption attribute. Ensure the caption conveys all meaningful information in the video element; this includes, but is not limited to, dialogue, musical cues, and sound effects.  Good captions not only include dialogue, but also identify who is speaking and include non-speech information conveyed through sound, including meaningful sound effects.  The following code shows how to add two different tracks - one in English and one in Spanish: <video width=""300"" height=""200"">  <source src=""myVideo.mp4"" type=""video/mp4"">  <track src=""captions_en.vtt"" kind=""captions"" srclang=""en"" label=""english_captions"">  <track src=""captions_es.vtt"" kind=""captions"" srclang=""es"" label=""spanish_captions""> </video> Note:  Captions and subtitles are not the same thing. Captions are necessary for  deaf viewers to understand the content. Captions include a text description  of all important background noises and other sounds, in addition to the text  of all dialog and narration. Subtitles are generally language translations,  to help listeners understand content presented in a language they don't  understand. A Spanish video file could contain English subtitles, for  example. Subtitles generally include only dialog and narration.   Given these differences, you should specify kind=""captions"" for  deaf access, and not kind=""subtitles"".  The src attribute gives the name of the track file. The kind attribute describes the contents of the file. The srclang attribute specifies the language of the track file using the appropriate HTML language code. The label attribute provides a name for the track. None of these attributes, aside from src, are required. Nevertheless, they are highly recommended because they increase clarity.  Youtube offers automatic captioning as a somewhat experimental feature. The automatic captions tend to be too inaccurate to use without some editing, but it gets rid of quite a bit of work. Another useful feature offered by YouTube is the ability to synchronize a transcript with the video automatically. You type up a transcript, upload it to YouTube, and YouTube processes the video and transcript together, using voice recognition to synchronize the transcript with the video. This feature tends to be entirely accurate. In some cases, no additional editing is necessary. In other cases, you need to tweak the timing a bit, but at least you don't have to do all the work manually. Why it Matters  If a video has no caption, deaf users have limited or no access to the information contained in it. Even if a captions track is available, ensure that it contains all meaningful information in the video, not just dialogue.  Deaf viewers can see everything in the video but are not able to hear any of it without captions. Without a caption track, deaf viewers do not have a way of knowing the dialog, narration, or the essential sounds not spoken by people, such as ""dramatic instrumental music,"" applause, screams, or other sounds that set the scene, provide context, or give meaning to the video. Rule Description  An HTML5 video element must include a track element with kind=""captions"" set as a property. The captions should convey all meaningful auditory information in the video including dialogue, musical cues, sound effects, and other relevant information for deaf users. The Algorithm (in simple terms) Ensures video elements have captions. Resources Deque University Deque University Course Pages (subscription required) Open Captions versus Closed CaptionsLive EventsPrerecorded MultimediaVisual CustomizabilityWhat to Include in CaptionsVisual Presentation of CaptionsCaption File Format  Deque University  Contribute to axe-core on GitHub Other Resources You may also want to check out these other resources. G87: Providing closed captionsG93: Providing open (always visible) captions Refer to the complete list of axe 4.7 rules. Was this information helpful?       You have already given your feedback, thank you.. Your response was as follows:  Was this information helpful? Date/Time feedback was submitted:       Edit your response Customer Feeddback Yes  No  Improvement feedback (see below)::        Contact Us Request a quote or demo Accessibility statement Site map  Main Deque Website 2121 Cooperative Way, Suite 210, Herndon, VA 20171 1-703-225-0380 © Copyright 2013 - 2023 Deque Systems. All rights reserved. See the Terms of Use.     URL of this webpage is: https://dequeuniversity.com/rules/axe/4.7/video-caption"
1,developer.chrome.comerrors in console.txt,"developer.chrome.comerrors in console.txt. Browser errors were logged to the console - Chrome DevelopersSkip to content  Home Docs Blog Articles  Home Docs Blog Articles Lighthouse Overview Performance audits Accessibility audits Best Practices audits SEO audits PWA audits Table of contentsHow the Lighthouse browser error audit failsHow to fix browser errorsResourcesThanks for tuning in to Google I/O. Watch the Chrome content on-demand. Watch now. DismissDocumentation Lighthouse Best Practices Audits Lighthouse Overview Performance audits Accessibility audits Best Practices audits SEO audits PWA audits Table of contentsHow the Lighthouse browser error audit failsHow to fix browser errorsResourcesBrowser errors were logged to the consolePublished on Thursday, May 2, 2019 • Updated on Wednesday, August 28, 2019 Translated to: Español, Português, 한국어, 中文Table of contents How the Lighthouse browser error audit failsHow to fix browser errorsResourcesMost browsers ship with built-in developer tools. These developer tools usually include a console. The console gives you information about the page that's currently running.Messages logged in the console come from either the web developers who built the page or the browser itself. All console messages have a severity level: Verbose, Info, Warning, or Error. An Error message means there's a problem on your page that you need to resolve.# How the Lighthouse browser error audit failsLighthouse flags all browser errors logged to the console:Each Best Practices audit is weighted equally in the Lighthouse Best Practices Score. Learn more in The Best Practices score.# How to fix browser errorsFix each browser error that Lighthouse reports to ensure that your page runs as expected for all your users.Chrome DevTools includes a couple tools to help you track down the cause of errors:Below the text of each error, the DevTools Console shows the call stack that caused the problematic code to execute.A link at the top-right of each error shows you the code that caused the error.For example, this screenshot shows a page with two errors:In the example above, the first error comes from a web developer via a call to console.error(). The second error comes from the browser and indicates that a variable used in one of the page's scripts does not exist.Below the text of each error, the DevTools Console indicates the call stack in which the error appears. For example, for the first error the Console indicates that an (anonymous) function called the init function, which called the doStuff function. Clicking the pen.js:9 link in the top-right of that error shows you the relevant code.Reviewing the relevant code for each error in this way can help you identify and resolve possible problems.If you can't figure out the cause of an error, try entering the error text into a search engine. If you can't find solutions to your problem, try asking a question on Stack Overflow.If you can't fix an error, consider wrapping it in a try…catch statement to explicitly indicate in the code that you're aware of the issue. You can also use the catch block to handle the error more gracefully.# ResourcesSource code for Browser errors were logged to the console auditConsole OverviewStack Overflowtry…catchUpdated on Wednesday, August 28, 2019 • Improve article Table of contentsHow the Lighthouse browser error audit failsHow to fix browser errorsResourcesFollow us Contribute File a bug View source Related content web.dev Case studies Podcasts Connect Twitter YouTube GitHub Chrome Firebase All products Privacy TermsContent available under the CC-BY-SA-4.0 licenseThis site uses cookies to deliver and enhance the quality of its services and to analyze traffic. If you agree, cookies are also used to serve advertising and to personalize the content and advertisements that you see. Learn more about our use of cookies. Agree No Thanks URL of this webpage is: https://developer.chrome.com/docs/lighthouse/best-practices/errors-in-console"
2,support.google.com911220.txt,"support.google.com911220.txt. Sorry, this page can't be found. - Search Console Help Skip to main content Search Console HelpSign inGoogle HelpHelp CenterSearch ConsolePrivacy PolicyTerms of ServiceSubmit feedback Send feedback on...This help content & informationGeneral Help Center experienceNextSearch Console  Sorry, this page can't be found. This page doesn't exist in Search Console Help. It may be deleted because the feature doesn't exist anymore, or the URL may be incorrect. Get Search Console Help Search on Google   ©2023 Google Privacy Policy Terms of Service  dansk‎Deutsch‎español‎français‎Indonesia‎italiano‎magyar‎Nederlands‎polski‎português (Brasil)‎suomi‎svenska‎Tiếng Việt‎Türkçe‎čeština‎русский‎‏עברית‏العربيةहिन्दी‎ไทย‎中文（简体）‎中文（繁體）‎日本語‎한국어‎ English‎   Enable Dark Mode Send feedback on... This help content & information General Help Center experience  SearchClear searchClose searchGoogle appsMain menu     false  Search Help Center true true true  true true 83844       false URL of this webpage is: https://support.google.com/webmasters/answer/911220"
