,fname,text
47,dequeuniversity.comaria hidden body.txt,"dequeuniversity.comaria hidden body.txt.    Axe Rules | Deque University | Deque Systems    Skip to content  Deque University  English日本語  Set Language    aria-hidden='true' must not be present on the document body Rule ID: aria-hidden-body Ruleset: axe-core 4.7 User Impact: Critical Guidelines: WCAG 2.1 (A), WCAG 2.0 (A)     Start building more accessible experiences  Axe DevTools Pro helps dev teams find and fix up to 80% of accessibility issues while coding. No experience required. Get started with your free trial today.  Start for free   Sign up for the axe newsletter Stay up to date on axe features, updates, and events. Newsletter Sign-up   Compliance Data & Impact User Impact Critical▼  Minor Critical  Disabilities Affected Blind  Standard(s) WCAG 2.1 (A)WCAG 2.0 (A) WCAG Success Criteria [WCAG 2.1 (A)]4.1.2: MUST: Name, Role, ValueWCAG Success Criteria [WCAG 2.0 (A)]4.1.2: MUST: Name, Role, Value  How to Fix the Problem  Remove the aria-hidden=""true"" attribute from the document body element. Caution: aria-hidden=""false"" is known to work inconsistently  when used in conjunction with styles or attributes that have historically  prevented rendering in all modalities, such as display: none,  visibility: hidden in CSS, or the hidden attribute in HTML5.  Use caution and test thoroughly before relying on this approach.  Reconsider the location of the hidden content to determine whether you can relocate it to an area of the page other than the body element. Typically, content is hidden from screen readers to reduce the unnecessary information that screen reader users would tend to skip (redundant or extraneous content). Why it Matters  When <body aria-hidden=""true"", content is not accessible to assistive technology.  Applying aria-hidden=""true"" to otherwise accessible objects: A web page is designed to be fully accessible, and it would be accessible if elements do not contain the aria-hidden=""true"" attribute value. Screen readers do not read content marked with the aria-hidden=""true"" attribute value. Users can still tab to focusable elements in the hidden objects, but screen readers remain silent.  Any content or interface elements intentionally hidden from users — e.g., inactive dialogs, collapsed menus — must also be hidden from screen reader users. When items are available to sighted users — such as when they activate a button or expand a menu item — the same items must be available to screen reader users. The goal is to provide screen reader users an equivalent user experience to sighted users. If there is a compelling reason to hide content from sighted users, there is usually a compelling reason also to hide that content from blind users. Further, when content is made available to sighted users, it makes sense to make it available to blind users as well. Rule Description  Document content is not accessible to assistive technology if <body aria-hidden=""true"">. The Algorithm (in simple terms)  Checks for the presence of the aria-hidden=""true"" attribute the document's body element and alerts with a pass or fail message accordingly.  Resources Deque University Deque University Course Pages (subscription required) Web Accessibility, Part 9: Custom JavaScript/ARIA WidgetsARIA Concepts  Deque University  Contribute to axe-core on GitHub Other Resources You may also want to check out these other resources. W3C WAI-ARIA 1.1 States and Properties - aria-hidden Refer to the complete list of axe 4.7 rules. Was this information helpful?       You have already given your feedback, thank you.. Your response was as follows:  Was this information helpful? Date/Time feedback was submitted:       Edit your response Customer Feeddback Yes  No  Improvement feedback (see below)::        Contact Us Request a quote or demo Accessibility statement Site map  Main Deque Website 2121 Cooperative Way, Suite 210, Herndon, VA 20171 1-703-225-0380 © Copyright 2013 - 2023 Deque Systems. All rights reserved. See the Terms of Use.     URL of this webpage is: https://dequeuniversity.com/rules/axe/4.7/aria-hidden-body"
48,dequeuniversity.combutton name.txt,"dequeuniversity.combutton name.txt.    Axe Rules | Deque University | Deque Systems    Skip to content  Deque University  English日本語  Set Language    Buttons must have discernible text Rule ID: button-name Ruleset: axe-core 4.7 User Impact: Critical Guidelines: WCAG 2.1 (A), WCAG 2.0 (A), Section 508     Accessibility testing for dev teams - No experience required  Find and fix up to 80% of accessibility issues with axe DevTools Pro. Get started with your free trial today. No credit card needed.   Start for free   Sign up for the axe newsletter Stay up to date on axe features, updates, and events. Newsletter Sign-up   Compliance Data & Impact User Impact Critical▼  Minor Critical  Disabilities Affected Blind Deafblind  Standard(s) WCAG 2.1 (A)WCAG 2.0 (A)Section 508 WCAG Success Criteria [WCAG 2.1 (A)]4.1.2: MUST: Name, Role, ValueWCAG Success Criteria [WCAG 2.0 (A)]4.1.2: MUST: Name, Role, ValueSection 508 Guidelines1194.22: MUST: Web based intranet and Internet Information & Applications1194.22 (a): MUST: A text equivalent for every non-text element shall be provided (e.g., via ""alt"", ""longdesc"", or in element content)  How to Fix the Problem Correct markup solutions  The button-name rule has five markup patterns that pass test  criteria: <button id=""text"">Name</button> <button id=""al"" aria-label=""Name""></button> <button id=""alb"" aria-labelledby=""labeldiv""></button> <div id=""labeldiv"">Button label</div> <button id=""combo"" aria-label=""Aria Name"">Name</button> <button id=""buttonTitle"" title=""Title""></button>   Ensure that each button element and elements with  role=""button"" have one of the following characteristics:  Inner text that is discernible to screen reader users. Non-empty aria-label attribute. aria-labelledby pointing to element with text which is   discernible to screen reader users.   role=""presentation"" or role=""none"" (ARIA 1.1)   and is not in tab order (tabindex=""-1"").    Incorrect markup solutions  The button-name rule has six markup patterns that fail testing  criteria: <button id=""empty""></button> <button id=""val"" value=""Button Name""></button> <button id=""alempty"" aria-label=""""></button> <button id=""albmissing"" aria-labelledby=""nonexistent""></button> <button id=""albempty"" aria-labelledby=""emptydiv""></button> <div id=""emptydiv""></div> <button id=""buttonvalue"" value=""foo"" tabindex=""-1""></button> Why it Matters  Screen reader users are not able to discern the purpose of elements with role=""link"", role=""button"", or role=""menuitem"" that do not have an accessible name. Rule Description  Buttons must have discernible text that clearly describes the destination, purpose, function, or action for screen reader users.  The input-button-name rule separates functionality from the button-name rule to ensure that input buttons have discernible text; advise relevant to input button names was incorrect for button elements. The Algorithm (in simple terms)  Checks all buttons to ensure that they have a discernable, accessible name.  Resources Deque University Deque University Course Pages (subscription required) LabelsGroup LabelsInstructions and Other Helpful InfoInstructions for Inputs  Deque University  Contribute to axe-core on GitHub Refer to the complete list of axe 4.7 rules. Was this information helpful?       You have already given your feedback, thank you.. Your response was as follows:  Was this information helpful? Date/Time feedback was submitted:       Edit your response Customer Feeddback Yes  No  Improvement feedback (see below)::        Contact Us Request a quote or demo Accessibility statement Site map  Main Deque Website 2121 Cooperative Way, Suite 210, Herndon, VA 20171 1-703-225-0380 © Copyright 2013 - 2023 Deque Systems. All rights reserved. See the Terms of Use.     URL of this webpage is: https://dequeuniversity.com/rules/axe/4.7/button-name"
49,dequeuniversity.comaria input field name.txt,"dequeuniversity.comaria input field name.txt.    Axe Rules | Deque University | Deque Systems    Skip to content  Deque University  English日本語  Set Language    ARIA input fields must have an accessible name Rule ID: aria-input-field-name Ruleset: axe-core 4.7 User Impact: Serious Guidelines: WCAG 2.1 (A), WCAG 2.0 (A)     Need accessibility training?  Deque University offers an extensive curriculum of self-guided online courses for every skillset and experience level.  Start learning today   Sign up for the axe newsletter Stay up to date on axe features, updates, and events. Newsletter Sign-up   Compliance Data & Impact User Impact Serious▼  Minor Critical  Disabilities Affected Blind Deafblind Mobility  Standard(s) WCAG 2.1 (A)WCAG 2.0 (A) WCAG Success Criteria [WCAG 2.1 (A)]4.1.2: MUST: Name, Role, ValueWCAG Success Criteria [WCAG 2.0 (A)]4.1.2: MUST: Name, Role, Value  How to Fix the Problem Correct markup solutions  The aria-input-field-label rule includes six markup patterns  that pass testing criteria: <!-- combobox --> <div id=""pass1"" aria-label=""country"" role=""combobox"">England</div> <!-- Select a color: --> <div id=""pass2"" role=""listbox"" aria-labelledby=""pass2Label"">  <div role=""option"">Orange</div> </div> <!-- searchbox --> <p id=""pass3Label"">Search currency pairs:</p> <div id=""pass3""  role=""searchbox""  contenteditable=""true""  aria-labelledby=""pass3Label""></div> <!-- slider --> <div id=""pass4""  role=""slider""  aria-label=""Choose a value""  aria-valuemin=""1""  aria-valuemax=""7""  aria-valuenow=""2""></div> <!-- spinbutton --> <div id=""pass5""  role=""spinbutton""  aria-valuemin=""0""  aria-valuemax=""10""  aria-valuenow=""8""  aria-label=""Enter quantity:""></div> <!-- textbox --> <label id=""foo"">  foo  <div id=""pass6"" role=""textbox"" aria-labelledby=""foo""></div> </label> Incorrect markup solutions  The aria-input-field-label rule includes ten markup patterns  that fail testing criteria: <!-- aria-label with empty text string --> <div id=""fail1"" aria-label="" "" role=""combobox"">England</div> <!-- The label does not exist. --> <div id=""fail2"" aria-labelledby=""non-existing"" role=""combobox"">England</div> <!-- The implicit label is not supported on div elements. --> <label>  first name  <div id=""fail3"" role=""textbox""></div> </label> <!-- explicit label not supported on div elements --> <label for=""fail4"">first name</label> <div role=""textbox"" id=""fail4""></div> <!-- combobox --> <div id=""fail5"" role=""combobox"">England</div> <!-- listbox --> <div id=""fail6"" role=""listbox"" aria-labelledby=""label-does-not-exist"">  <div role=""option"">Orange</div> </div> <!-- searchbox --> <div id=""fail7""  role=""searchbox""  contenteditable=""true""  aria-labelledby=""unknown-label""></div>  <!-- slider --> <div id=""fail8""  role=""slider""  aria-valuemin=""1""  aria-valuemax=""7""  aria-valuenow=""2""></div> <!-- spinbutton --> <div id=""fail9""  role=""spinbutton""  aria-valuemin=""0""  aria-valuemax=""10""  aria-valuenow=""8""></div> <!-- textbox --> <label>foo  <div id=""fail10"" role=""textbox""></div> </label>  Why it Matters  This new rule ensures every ARIA input field has an accessible name. Accessible names must exist for the following input field roles: combobox listbox searchbox slider spinbutton textbox Rule Description Ensures every ARIA input field has an accessible name. The Algorithm (in simple terms) ARIA input fields must have an accessible name. Resources Deque University Deque University Course Pages (subscription required) 						No related course information available. 					  Deque University  Contribute to axe-core on GitHub Refer to the complete list of axe 4.7 rules. Was this information helpful?       You have already given your feedback, thank you.. Your response was as follows:  Was this information helpful? Date/Time feedback was submitted:       Edit your response Customer Feeddback Yes  No  Improvement feedback (see below)::        Contact Us Request a quote or demo Accessibility statement Site map  Main Deque Website 2121 Cooperative Way, Suite 210, Herndon, VA 20171 1-703-225-0380 © Copyright 2013 - 2023 Deque Systems. All rights reserved. See the Terms of Use.     URL of this webpage is: https://dequeuniversity.com/rules/axe/4.7/aria-input-field-name"
50,dequeuniversity.comduplicate id active.txt,"dequeuniversity.comduplicate id active.txt.    Axe Rules | Deque University | Deque Systems    Skip to content  Deque University  English日本語  Set Language    IDs of active elements must be unique Rule ID: duplicate-id-active Ruleset: axe-core 4.7 User Impact: Serious Guidelines: WCAG 2.1 (A), WCAG 2.0 (A)     Accessibility testing for dev teams - No experience required  Find and fix up to 80% of accessibility issues with axe DevTools Pro. Get started with your free trial today. No credit card needed.   Start for free   Sign up for the axe newsletter Stay up to date on axe features, updates, and events. Newsletter Sign-up   Compliance Data & Impact User Impact Serious▼  Minor Critical  Disabilities Affected Blind Deafblind  Standard(s) WCAG 2.1 (A)WCAG 2.0 (A) WCAG Success Criteria [WCAG 2.1 (A)]4.1.1: MUST: ParsingWCAG Success Criteria [WCAG 2.0 (A)]4.1.1: MUST: Parsing  How to Fix the Problem Rename attributes that reuse an ID on active, focusable elements. Duplicate active IDs are common validation errors that can break the accessibility of labels for focusable elements, forms, table header cells, etc.  To fix the problem, change the duplicate ID value to ensure each ID is unique. Unique ID values differentiate each focusable element from another and prevent invalid markup and the active ID instance is acted upon by client-side scripting, or where assistive technologies typically only reference the active ID of repeated elements.  Good markup eliminates at least one possible source of accessibility problems. WCAG 1.0 used to have a provision which explicitly required the use of valid markup. That requirement has been taken out of WCAG 2.0. We mention it here because valid markup is a quick path toward ensuring accessibility. Most validation issues are usually inconsequential for accessibility (e.g., un-encoded ampersands). Other ID validation errors are very important and may cause issues relating to how assistive technology interacts with the page and renders the page to the end user.  One way to test the validity of HTML markup in order to quickly identify reused attribute ID values is to submit the code through the W3C validator at http://validator.w3.org. Why it Matters  The ID attribute uniquely identifies focusable elements on a page. It does not make sense to duplicate an active ID.  Duplicate active ID values break the accessibility of focusable elements including labels for forms, table header cells, etc., Screen readers and client-side scripts will skip any duplication other than the first instance. Validating HTML files help prevent and eliminate possible sources of accessibility problems, when not breaking accessibility.  Those experienced with client-side scripting know that when you re-use an active ID, typically the only one that gets acted upon by the scripting is the first instance of the use of that active ID. Similarly, assistive technologies may, when referencing an active ID, only reference the first one accurately. Rule Description  The value assigned to active ID attributes on focusable elements must be unique to prevent the second instance from being overlooked by assistive technology. Put another way, active ID attributes may not be used more than once on focusable elements in the same document; focusable active elements require unique IDs for assistive technology to distinguish one element from another. The Algorithm (in simple terms)  Ensures that each focusable element on the page with an active ID has a unique value.  Resources Deque University Deque University Course Pages (subscription required) Parsing and ValidityConflicts and duplicates  Deque University  Contribute to axe-core on GitHub Other Resources You may also want to check out these other resources. F77: Failure of Success Criterion 4.1.1 due to duplicate values of type ID Refer to the complete list of axe 4.7 rules. Was this information helpful?       You have already given your feedback, thank you.. Your response was as follows:  Was this information helpful? Date/Time feedback was submitted:       Edit your response Customer Feeddback Yes  No  Improvement feedback (see below)::        Contact Us Request a quote or demo Accessibility statement Site map  Main Deque Website 2121 Cooperative Way, Suite 210, Herndon, VA 20171 1-703-225-0380 © Copyright 2013 - 2023 Deque Systems. All rights reserved. See the Terms of Use.     URL of this webpage is: https://dequeuniversity.com/rules/axe/4.7/duplicate-id-active"
51,search.google.comtesting tool.txt,"search.google.comtesting tool.txt.      Schema Markup Testing Tool | Google Search Central  |  Google for Developers       Google Search Central    Documentation    SEO fundamentals       Introduction             Search Essentials             Get your website on Google             How Google Search Works             SEO starter guide             Do you need an SEO?       Crawling and indexing       Sitemaps             robots.txt             Meta tags             Crawler management             Removals             Canonicalization             Redirects             JavaScript SEO       Ranking and search appearance       Visual Elements gallery             Title links             Snippets             Images             Videos             Structured data             Favicons       Site-specific guides       Ecommerce             International and multilingual sites             Education         Support    Blog    What's new          All updates             Documentation updates             Ranking updates             New YouTube videos             Recent podcast episodes         Events    Case studies        English Bahasa Indonesia Deutsch Español Español – América Latina Français Italiano Polski Português – Brasil Tiếng Việt Türkçe Русский العربيّة हिंदी ภาษาไทย 中文 – 简体 中文 – 繁體 日本語 한국어  Sign in        Google Search Central        Documentation     More     Support     Blog     What's new     More     Events     Case studies      SEO fundamentals    Introduction    Search Essentials    Get your website on Google    How Google Search Works    SEO starter guide    Do you need an SEO?    Crawling and indexing    Sitemaps    robots.txt    Meta tags    Crawler management    Removals    Canonicalization    Redirects    JavaScript SEO    Ranking and search appearance    Visual Elements gallery    Title links    Snippets    Images    Videos    Structured data    Favicons    Site-specific guides    Ecommerce    International and multilingual sites    Education     All updates    Documentation updates    Ranking updates    New YouTube videos    Recent podcast episodes          Home       Search Central       Send feedback        Stay organized with collections        Save and categorize content based on your preferences.           Test your structured data        Google recommends that you start with the Rich Results Test to see what Google rich results can be generated for your page. For generic schema validation, use the Schema Markup Validator to test all types of schema.org markup, without Google-specific validation.            Rich Results Test    The official Google tool for testing your structured data to see which Google rich results can be generated by the structured data on your page. You can also preview how rich results can look in Google Search. Go to the Rich Results Test        Schema Markup Validator    Validate all Schema.org-based structured data that's embedded in web pages, without Google feature specific warnings. Go to the Schema Markup Validator        Looking for the Structured Data Testing Tool?       We removed Google-specific validation from the Structured Data Testing Tool and migrated the tool to a new domain, Schema Markup Validator. Learn more about the change in our blog post.    Read the blog post              Podcast  Listen to our Search Off the Record podcast         Blog  Subscribe to our RSS feed         Twitter  Follow @googlesearchc on Twitter   Get support          Go to the help forum                Submit a question for office hours                           More support resources       Get updates          Blog                Twitter                           YouTube       Resources          Do you need an SEO?                SEO Starter Guide                Status of Search systems                Search Console documentation                           Case Studies       Tools          Search Console                Mobile-Friendly Test                Rich Results Test                PageSpeed Insights                           AMP Test             Android      Chrome      Firebase      Google Cloud Platform      All products       Terms      Privacy   Sign up for the Google for Developers newsletter   Subscribe    English Bahasa Indonesia Deutsch Español Español – América Latina Français Italiano Polski Português – Brasil Tiếng Việt Türkçe Русский العربيّة हिंदी ภาษาไทย 中文 – 简体 中文 – 繁體 日本語 한국어      URL of this webpage is: https://search.google.com/structured-data/testing-tool"
